{
  "loopId": "gmail-action-execution-loop-v1",
  "version": "1.0.0",
  "displayName": "Gmail Action Execution Loop",
  "description": "Executes approved Gmail actions (reply, forward, label, archive) with delivery confirmation tracking.",
  "ownerAgent": "gmail-integration-agent",
  "category": "integration-gmail",
  "tier": "B",
  "dependencyLayer": "integration",
  "priority": 55,
  "triggerTypes": [
    "event",
    "manual"
  ],
  "triggerClass": "event-triggered",
  "cadence": {
    "default": "event-driven"
  },
  "entryCriteria": [
    "approved_gmail_action_queued_for_execution"
  ],
  "hardStops": [
    "budget_exhausted",
    "operator_abort",
    "gmail-action-execution-loop_critical_failure"
  ],
  "requiredContext": [
    "AGENTS.md",
    "integration-gmail_context"
  ],
  "thinkingPolicy": {
    "default": "medium",
    "escalateTo": "high",
    "escalateOn": [
      "auth_failure"
    ],
    "deescalateOn": [
      "budget_pressure"
    ]
  },
  "allowedTools": [
    "gmail.api",
    "memory.write",
    "config.read"
  ],
  "forbiddenTools": [
    "host.exec",
    "browser.navigate"
  ],
  "toolTierBudget": "tier-1",
  "approvalPoints": [
    "gmail_action_execution"
  ],
  "approvalRequired": true,
  "maxSteps": 12,
  "maxDurationSec": 180,
  "riskTier": "moderate",
  "successCriteria": [
    "gmail_action_executed_with_delivery_confirmation"
  ],
  "rollbackPlan": "Abort Gmail operation and log failure event.",
  "fallbackLoopChain": [
    "research-loop-v1"
  ],
  "terminationPolicy": "retry_then_escalate",
  "writebacks": {
    "memory": true,
    "logs": true,
    "actionArtifacts": true,
    "auditTrail": true
  },
  "outputContract": {
    "summaryRequired": true,
    "confidenceRequired": false,
    "evidenceRequired": false,
    "actionsRequired": true,
    "nextRequired": false
  },
  "loopLifecycleStates": [
    "queued",
    "preflight",
    "context-build",
    "reason",
    "act",
    "verify",
    "commit",
    "archive"
  ],
  "guardrails": {
    "confidenceThreshold": 0.5,
    "toolFailureBudget": 3,
    "sideEffectApprovalRequired": false
  },
  "composition": {
    "canBeCalledBy": [
      "ralph-loop-v1"
    ],
    "canCall": []
  }
}
