{
  "loopId": "pairing-challenge-trust-loop-v1",
  "version": "1.0.0",
  "displayName": "Pairing Challenge and Trust Loop",
  "description": "Executes device/sender pairing challenge protocol establishing trust relationship for unknown senders.",
  "ownerAgent": "auth-boundary-agent",
  "category": "security",
  "tier": "A",
  "dependencyLayer": "security",
  "priority": 66,
  "triggerTypes": [
    "event"
  ],
  "triggerClass": "always-on",
  "cadence": {
    "default": "continuous"
  },
  "entryCriteria": [
    "unknown_sender_contact_attempt_detected"
  ],
  "hardStops": [
    "budget_exhausted",
    "operator_abort",
    "pairing-challenge-trust-loop_critical_failure"
  ],
  "requiredContext": [
    "AGENTS.md",
    "security_context"
  ],
  "thinkingPolicy": {
    "default": "high",
    "escalateTo": "xhigh",
    "escalateOn": [
      "active_threat_detected"
    ],
    "deescalateOn": [
      "false_positive_confirmed"
    ]
  },
  "allowedTools": [
    "memory.search",
    "memory.write",
    "config.read",
    "metrics.query",
    "auth.verify"
  ],
  "forbiddenTools": [
    "host.exec",
    "browser.navigate"
  ],
  "toolTierBudget": "tier-1",
  "approvalPoints": [
    "privilege_escalation"
  ],
  "approvalRequired": false,
  "maxSteps": 15,
  "maxDurationSec": 300,
  "riskTier": "moderate",
  "successCriteria": [
    "pairing_challenge_completed_trust_established"
  ],
  "rollbackPlan": "Revert to last known secure state and alert operator.",
  "fallbackLoopChain": [
    "incident-containment-loop-v1"
  ],
  "terminationPolicy": "hard_stop_and_alert",
  "writebacks": {
    "memory": true,
    "logs": true,
    "actionArtifacts": true,
    "auditTrail": true
  },
  "outputContract": {
    "summaryRequired": true,
    "confidenceRequired": true,
    "evidenceRequired": true,
    "actionsRequired": true,
    "nextRequired": true
  },
  "loopLifecycleStates": [
    "queued",
    "preflight",
    "context-build",
    "reason",
    "act",
    "verify",
    "commit",
    "archive"
  ],
  "guardrails": {
    "confidenceThreshold": 0.7,
    "toolFailureBudget": 2,
    "sideEffectApprovalRequired": true
  },
  "composition": {
    "canBeCalledBy": [
      "ralph-loop-v1"
    ],
    "canCall": []
  }
}
