{
  "loopId": "objective-conflict-resolver-loop-v1",
  "version": "1.0.0",
  "displayName": "Objective Conflict Resolver Loop",
  "description": "Detects and resolves conflicting objectives between concurrent autonomous loops using priority arbitration.",
  "ownerAgent": "portfolio-orchestrator-agent",
  "category": "governance",
  "tier": "B",
  "dependencyLayer": "governance",
  "priority": 90,
  "triggerTypes": [
    "event",
    "cron"
  ],
  "triggerClass": "scheduled",
  "cadence": {
    "default": "daily"
  },
  "entryCriteria": [
    "concurrent_loop_objectives_conflict_detected"
  ],
  "hardStops": [
    "budget_exhausted",
    "operator_abort",
    "objective-conflict-resolver-loop_critical_failure"
  ],
  "requiredContext": [
    "AGENTS.md",
    "governance_context"
  ],
  "thinkingPolicy": {
    "default": "high",
    "escalateTo": "xhigh",
    "escalateOn": [
      "policy_violation_detected"
    ],
    "deescalateOn": [
      "budget_pressure"
    ]
  },
  "allowedTools": [
    "memory.search",
    "memory.write",
    "config.read",
    "tasks.read"
  ],
  "forbiddenTools": [
    "host.exec",
    "browser.navigate",
    "email.send",
    "config.write"
  ],
  "toolTierBudget": "tier-1",
  "approvalPoints": [
    "policy_change"
  ],
  "approvalRequired": false,
  "maxSteps": 14,
  "maxDurationSec": 300,
  "riskTier": "moderate",
  "successCriteria": [
    "objective_conflicts_resolved_via_arbitration"
  ],
  "rollbackPlan": "Retain current governance policy and log audit failure.",
  "fallbackLoopChain": [
    "planning-loop-v1"
  ],
  "terminationPolicy": "safe_stop_and_report",
  "writebacks": {
    "memory": true,
    "logs": true,
    "actionArtifacts": true,
    "auditTrail": true
  },
  "outputContract": {
    "summaryRequired": true,
    "confidenceRequired": true,
    "evidenceRequired": true,
    "actionsRequired": true,
    "nextRequired": true
  },
  "loopLifecycleStates": [
    "queued",
    "preflight",
    "context-build",
    "reason",
    "act",
    "verify",
    "commit",
    "archive"
  ],
  "guardrails": {
    "confidenceThreshold": 0.6,
    "toolFailureBudget": 2,
    "sideEffectApprovalRequired": true
  },
  "composition": {
    "canBeCalledBy": [
      "ralph-loop-v1"
    ],
    "canCall": []
  }
}
