{
  "loopId": "planning-loop-v1",
  "version": "1.0.0",
  "tier": "core",
  "displayName": "Planning Loop",
  "description": "Reprioritizes execution backlog with cost/risk/confidence scoring. Transforms research bundles into ordered executable plans.",
  "ownerAgent": "planning-agent",
  "category": "strategic",
  "dependencyLayer": "strategic",
  "priority": 2,
  "triggerTypes": [
    "cron",
    "manual",
    "self-driven",
    "heartbeat"
  ],
  "triggerClass": "manual-scheduled-hybrid",
  "cadence": {
    "default": "daily",
    "quietHours": "suppress",
    "override": "on-major-context-change"
  },
  "entryCriteria": [
    "backlog_exists_and_policy_allows_autonomy",
    "planning_budget_available"
  ],
  "hardStops": [
    "plan_conflict_with_active_loops",
    "budget_exhausted",
    "operator_abort"
  ],
  "requiredContext": [
    "AGENTS.md",
    "backlog_state",
    "resource_budget",
    "active_loop_states",
    "priority_policy"
  ],
  "thinkingPolicy": {
    "default": "xhigh",
    "escalateTo": "xhigh",
    "escalateOn": [
      "repeat_failure",
      "high_ambiguity"
    ],
    "deescalateOn": [
      "budget_pressure"
    ]
  },
  "allowedTools": [
    "memory.search",
    "memory.write",
    "scheduler.list",
    "tasks.write",
    "tasks.read"
  ],
  "forbiddenTools": [
    "host.exec",
    "browser.navigate",
    "email.send"
  ],
  "toolTierBudget": "tier-1",
  "approvalPoints": [
    "external_side_effects",
    "tier2_tools"
  ],
  "approvalRequired": false,
  "maxSteps": 20,
  "maxDurationSec": 720,
  "riskTier": "safe",
  "successCriteria": [
    "prioritized_plan_emitted",
    "memory_writeback_complete",
    "execution_backlog_ordered_with_budgets"
  ],
  "rollbackPlan": "Revert to previous backlog ordering and notify operator.",
  "fallbackLoopChain": [
    "research-loop-v1",
    "discovery-loop-v1"
  ],
  "terminationPolicy": "safe_stop_and_report",
  "writebacks": {
    "memory": true,
    "logs": true,
    "actionArtifacts": true,
    "auditTrail": true
  },
  "outputContract": {
    "summaryRequired": true,
    "confidenceRequired": true,
    "evidenceRequired": false,
    "actionsRequired": true,
    "nextRequired": true
  },
  "loopLifecycleStates": [
    "queued",
    "preflight",
    "context-build",
    "reason",
    "act",
    "verify",
    "commit",
    "reflect",
    "archive"
  ],
  "guardrails": {
    "confidenceThreshold": 0.65,
    "toolFailureBudget": 3,
    "sideEffectApprovalRequired": false
  },
  "composition": {
    "canBeCalledBy": [
      "ralph-loop-v1",
      "self-driven-loop-v1"
    ],
    "canCall": [
      "research-loop-v1",
      "discovery-loop-v1"
    ]
  }
}
