{
  "loopId": "model-fallback-loop-v1",
  "version": "1.0.0",
  "displayName": "Model Fallback Loop",
  "description": "Routes model requests through primary/fallback/codex chain: gpt-5.2 primary, gpt-5.2-pro fallback, gpt-5.2-codex for coding.",
  "ownerAgent": "gpt52-router-agent",
  "category": "runtime",
  "tier": "A",
  "dependencyLayer": "runtime-orchestration",
  "priority": 43,
  "triggerTypes": [
    "event"
  ],
  "triggerClass": "always-on",
  "cadence": {
    "default": "continuous"
  },
  "entryCriteria": [
    "model_request_failed_on_primary_provider"
  ],
  "hardStops": [
    "budget_exhausted",
    "operator_abort",
    "model-fallback-loop_critical_failure"
  ],
  "requiredContext": [
    "AGENTS.md",
    "runtime_context"
  ],
  "thinkingPolicy": {
    "default": "medium",
    "escalateTo": "high",
    "escalateOn": [
      "repeated_failure"
    ],
    "deescalateOn": [
      "budget_pressure"
    ]
  },
  "allowedTools": [
    "memory.search",
    "metrics.query",
    "config.read"
  ],
  "forbiddenTools": [
    "host.exec",
    "browser.navigate",
    "email.send"
  ],
  "toolTierBudget": "tier-0",
  "approvalPoints": [],
  "approvalRequired": false,
  "maxSteps": 10,
  "maxDurationSec": 120,
  "riskTier": "safe",
  "successCriteria": [
    "model_request_routed_to_fallback_provider"
  ],
  "rollbackPlan": "Revert to previous state and emit error event.",
  "fallbackLoopChain": [],
  "terminationPolicy": "retry_then_escalate",
  "writebacks": {
    "memory": false,
    "logs": true,
    "actionArtifacts": false,
    "auditTrail": true
  },
  "outputContract": {
    "summaryRequired": true,
    "confidenceRequired": false,
    "evidenceRequired": false,
    "actionsRequired": false,
    "nextRequired": false
  },
  "loopLifecycleStates": [
    "queued",
    "preflight",
    "context-build",
    "reason",
    "act",
    "verify",
    "commit",
    "archive"
  ],
  "guardrails": {
    "confidenceThreshold": 0.5,
    "toolFailureBudget": 3,
    "sideEffectApprovalRequired": false
  },
  "composition": {
    "canBeCalledBy": [
      "ralph-loop-v1"
    ],
    "canCall": []
  }
}
