{
  "loopId": "memory-consolidation-loop-v1",
  "version": "1.0.0",
  "displayName": "Memory Consolidation Loop",
  "description": "Consolidates fragmented memory entries into coherent knowledge structures during maintenance windows.",
  "ownerAgent": "compaction-agent",
  "category": "context-memory",
  "tier": "B",
  "dependencyLayer": "context-memory",
  "priority": 48,
  "triggerTypes": [
    "event",
    "cron"
  ],
  "triggerClass": "scheduled",
  "cadence": {
    "default": "daily"
  },
  "entryCriteria": [
    "fragmented_memory_entries_exceed_consolidation_threshold"
  ],
  "hardStops": [
    "budget_exhausted",
    "operator_abort",
    "memory-consolidation-loop_critical_failure"
  ],
  "requiredContext": [
    "AGENTS.md",
    "context-memory_context"
  ],
  "thinkingPolicy": {
    "default": "medium",
    "escalateTo": "high",
    "escalateOn": [
      "data_inconsistency"
    ],
    "deescalateOn": [
      "budget_pressure"
    ]
  },
  "allowedTools": [
    "memory.search",
    "memory.write",
    "file.read",
    "config.read"
  ],
  "forbiddenTools": [
    "host.exec",
    "browser.navigate",
    "email.send"
  ],
  "toolTierBudget": "tier-0",
  "approvalPoints": [],
  "approvalRequired": false,
  "maxSteps": 14,
  "maxDurationSec": 300,
  "riskTier": "safe",
  "successCriteria": [
    "fragmented_memories_consolidated_into_structures"
  ],
  "rollbackPlan": "Discard pending writes and retain current state.",
  "fallbackLoopChain": [
    "research-loop-v1"
  ],
  "terminationPolicy": "safe_stop_and_report",
  "writebacks": {
    "memory": true,
    "logs": true,
    "actionArtifacts": false,
    "auditTrail": false
  },
  "outputContract": {
    "summaryRequired": true,
    "confidenceRequired": false,
    "evidenceRequired": false,
    "actionsRequired": false,
    "nextRequired": true
  },
  "loopLifecycleStates": [
    "queued",
    "preflight",
    "context-build",
    "reason",
    "act",
    "verify",
    "commit",
    "archive"
  ],
  "guardrails": {
    "confidenceThreshold": 0.5,
    "toolFailureBudget": 3,
    "sideEffectApprovalRequired": false
  },
  "composition": {
    "canBeCalledBy": [
      "ralph-loop-v1"
    ],
    "canCall": []
  }
}
